"Status","Start Time","Stop Time","Duration in ms","Parent Suite","Suite","Sub Suite","Test Class","Test Method","Name","Description"
"passed","Wed Mar 25 14:00:09 UTC 2026","Wed Mar 25 14:00:09 UTC 2026","172","tests.api","test_portfolio","","","","Portfolio returns correct structure",""
"skipped","Wed Mar 25 14:00:08 UTC 2026","Wed Mar 25 14:00:08 UTC 2026","0","tests.api","test_points","","","","Portfolio points match leaderboard points for top addresses","
    Берём первые 10 адресов из лидерборда и для каждого сравниваем
    portfolio.points с leaderboard.points.
    Оба эндпоинта — PROD ETH /api/v2.
    "
"skipped","Wed Mar 25 13:59:35 UTC 2026","Wed Mar 25 13:59:35 UTC 2026","0","tests.api","test_leaderboard","","","","Leaderboard response matches Pydantic model",""
"passed","Wed Mar 25 14:00:09 UTC 2026","Wed Mar 25 14:00:09 UTC 2026","191","tests.api","test_pools_list","","","","Pool list response matches Pydantic model",""
"passed","Wed Mar 25 14:00:08 UTC 2026","Wed Mar 25 14:00:09 UTC 2026","483","tests.api","test_pool_detail","","","","Pool detail returns correct structure",""
"passed","Wed Mar 25 13:59:35 UTC 2026","Wed Mar 25 13:59:35 UTC 2026","525","tests.api","test_healthcheck","","","","API documentation endpoint is available",""
